{
  "$schema": "http://json-schema.org/draft-07/schema#",
  "$id": "https://machine_max.io/schemas/connector/connector_static_attr.schema.json",
  "title": "连接点静态属性",
  "description": "定义连接点的静态属性，包括类型、方向、结构完整性、冲击处理等。这些属性通过定义ID引用，避免在每个零件定义中重复定义。",
  "type": "object",
  "properties": {
    "$schema": {
      "type": "string",
      "description": "JSON Schema引用路径，用于编辑器智能提示和验证",
      "default": "../docs/zh_cn/schemas/part/subpart/connector/connector_static_attr.schema.json"
    },
    "type": {
      "type": "string",
      "enum": ["Simple", "simple", "advanced", "Advanced"],
      "description": "连接点类型。Simple：简单连接点；Advanced：高级连接点，支持复杂的关节属性。"
    },
    "direction": {
      "allOf": [
        { "$ref": "../../../base/axis.schema.json" }
      ],
      "description": "连接点的法线方向，用于确定连接点的连接方向。x+为右，y+为上，z+为后。"
    },
    "integrity": {
      "type": "number",
      "minimum": 0,
      "default": 15.0,
      "description": "部件基础结构完整度，部件可承受不高于此数值的冲击力而不脱落，冲击力来自伤害或关节应力。"
    },
    "impact_reduction": {
      "type": "number",
      "minimum": 0,
      "default": 2.0,
      "description": "连接点的冲击减免值，在计算部件击落前应用，可将冲击削减至0以完全避免对结构完整性的影响。"
    },
    "impact_multiplier": {
      "type": "number",
      "minimum": 0,
      "default": 1.0,
      "description": "连接点的冲击吸收率，在计算部件击落前，应用冲击减免后应用，大于1将使连接点更容易断开。"
    },
    "impact_absorption": {
      "type": "number",
      "minimum": 0,
      "maximum": 1,
      "default": 0.3,
      "description": "连接点受到冲击但未被击落时，冲击转为结构完整性损耗的比例。例如0.5表示50%的冲击会转化为结构完整性的损耗。"
    },
    "impact_absorption_destroyed": {
      "type": "number",
      "minimum": 0,
      "default": 2.0,
      "description": "SubPart已摧毁时，冲击转为连接点完整性损耗的比例。例如2.0表示200%的冲击会转化为结构完整性的损耗（用于残骸快速解体）。"
    },
    "required_tags": {
      "type": "array",
      "items": { "$ref": "../../../base/resource_location.schema.json" },
      "default": [],
      "description": "连接部件必须全部拥有的标签，留空以允许任意标签。例如：[\"machine_max:left\"]表示必须包含左变体标签。"
    },
    "acceptable_tags": {
      "type": "array",
      "items": { "$ref": "../../../base/resource_location.schema.json" },
      "default": [],
      "description": "连接部件必须至少拥有其中一个的标签，留空以允许任意标签。例如：[\"machine_max:door\", \"machine_max:hatch\"]表示必须包含门或舱口标签之一。"
    },
    "forbidden_tags": {
      "type": "array",
      "items": { "$ref": "../../../base/resource_location.schema.json" },
      "default": [],
      "description": "连接部件不可包含的标签，留空以允许任意标签。例如：[\"machine_max:explosive\"]表示不能包含爆炸物标签。"
    },
    "joint_attrs": {
      "type": "object",
      "additionalProperties": { "$ref": "joint_attr.schema.json"},
      "default": {},
      "description": "关节属性，目前仅在关节类型为Advanced时生效。键为x、y、z、xr、yr、zr，分别代表x、y、z轴的平动和x、y、z轴的旋转。"
    },
    "collide_between_parts": {
      "type": "boolean",
      "default": false,
      "description": "连接点是否允许部件间碰撞。通常设置为false以避免连接点之间的穿透问题。"
    }
  },
  "required": ["type"],
  "additionalProperties": false,
  "examples": [
    {
      "type": "Simple",
      "description": "最简连接点示例，仅包含必需字段"
    },
    {
      "type": "Advanced",
      "required_tags": ["machine_max:direction/left"],
      "impact_absorption": 0.1,
      "impact_reduction": 3.0,
      "impact_multiplier": 0.5,
      "joint_attrs": {
        "y": {
          "lower_limit": -0.5,
          "upper_limit": 1.0,
          "stiffness": 28000,
          "damping": 1500
        },
        "yr": {
          "lower_limit": -45.0,
          "upper_limit": 45.0,
          "stiffness": 4000,
          "damping": 20
        }
      },
      "description": "左前轮连接点，仅允许左变体，具有垂直缓冲和转向能力，冲击吸收率较低，冲击减免较高"
    }
  ]
}
