{
  "$schema": "../docs/zh_cn/schemas/part/subpart/connector/connector_static_attr.schema.json",
  "type": "Advanced",
  "direction": "xn",
  "integrity": 80,
  "impact_reduction": 3,
  "impact_multiplier": 0.8,
  "required_tags": [
    "machine_max:left"
  ],
  "acceptable_tags": [],
  "forbidden_tags": [
    "machine_max:hull",
    "machine_max:chassis"
  ],
  "joint_attrs": {
    "y": {
      "lower_limit": -1,
      "upper_limit": 1,
      "equilibrium": -0.1,
      "stiffness": 86000,
      "damping": 1200
    },
    "xr": {
      "lower_limit": 1,
      "upper_limit": -1
    },
    "yr": {
      "lower_limit": -45,
      "upper_limit": 45,
      "stiffness": 1000,
      "damping": 20
    }
  }
}