{
  "$schema": "../../docs/zh_cn/schemas/part/subpart/connector/connector_static_attr.schema.json",
  "type": "Advanced",
  "direction": "xn",
  "integrity": 15.0,
  "impact_absorption": 0.30,
  "impact_reduction": 2.0,
  "impact_multiplier": 1.0,
  "required_tags": ["machine_max:direction/left"],
  "acceptable_tags": [],
  "forbidden_tags": ["machine_max:chassis", "machine_max:hull"],
  "joint_attrs": {
    "y": {
      "lower_limit": -0.5,
      "upper_limit": 1.0,
      "equilibrium": -0.15,
      "stiffness": 55000,
      "damping": 2500
    },
    "xr": {
      "lower_limit": 1.0,
      "upper_limit": -1.0
    },
    "zr": {
      "lower_limit": -1.0,
      "upper_limit": 5.0,
      "equilibrium": -1.0,
      "stiffness": 349.091563,
      "damping": 8.712058
    }
  }
}
