{
  "$schema": "../../docs/zh_cn/schemas/part/subpart/connector/connector_static_attr.schema.json",
  "type": "Advanced",
  "direction": "xn",
  "integrity": 15,
  "impact_absorption": 0.3,
  "impact_reduction": 2,
  "impact_multiplier": 1,
  "required_tags": [
    "machine_max:direction/left"
  ],
  "acceptable_tags": [],
  "forbidden_tags": [
    "machine_max:hull",
    "machine_max:chassis"
  ],
  "joint_attrs": {
    "y": {
      "lower_limit": -1,
      "upper_limit": 2,
      "equilibrium": -0.1,
      "stiffness": 86000,
      "damping": 4500
    },
    "xr": {
      "lower_limit": 1,
      "upper_limit": -1
    },
    "yr": {
      "lower_limit": -45,
      "upper_limit": 45,
      "stiffness": 17.363193,
      "damping": 0.35031
    }
  }
}