{
  "$schema": "../../docs/zh_cn/schemas/part/subpart/connector/connector_static_attr.schema.json",
  "type": "Advanced",
  "direction": "zn",
  "integrity": 15,
  "impact_absorption": 0.3,
  "impact_reduction": 2,
  "impact_multiplier": 1,
  "required_tags": [],
  "joint_attrs": {
    "z": {
      "lower_limit": 0,
      "upper_limit": 0.25,
      "stiffness": 30000,
      "damping": 2000
    }
  }
}