{
  "$schema": "../../docs/zh_cn/schemas/part/subpart/connector/connector_static_attr.schema.json",
  "type": "Advanced",
  "direction": "zn",
  "required_tags": ["machine_max:direction/front", "machine_max:bumper"],
  "integrity": 10.0,
  "impact_absorption": 0.50,
  "impact_reduction": 1.0,
  "impact_multiplier": 1.0,
  "joint_attrs": {
    "zr": {
      "lower_limit": -30.0,
      "upper_limit": 30.0,
      "equilibrium": 0.0,
      "stiffness": 87.120582,
      "damping": 1.736319
    }
  }
}
