{
  "$schema": "../../docs/zh_cn/schemas/part/subpart/connector/connector_static_attr.schema.json",
  "type": "Advanced",
  "direction": "xn",
  "integrity": 15.0,
  "impact_absorption": 0.30,
  "impact_reduction": 2.0,
  "impact_multiplier": 1.0,
  "required_tags": ["machine_max:direction/left"],
  "acceptable_tags": [],
  "forbidden_tags": [],
  "joint_attrs": {
    "y": {
      "lower_limit": -0.5,
      "upper_limit": 0.5,
      "equilibrium": -0.2,
      "stiffness": 70000,
      "damping": 3200
    },
    "xr": {
      "lower_limit": 1.0,
      "upper_limit": -1.0
    },
    "yr": {
      "lower_limit": -45.0,
      "upper_limit": 45.0,
      "stiffness": 104.788392,
      "damping": 0.35031
    },
    "zr": {
      "lower_limit": 1.0,
      "upper_limit": 5.0,
      "equilibrium": 1.0,
      "stiffness": 1745.457815,
      "damping": 43.621215
    }
  }
}
